title,Root_topic
An unusual glimpse at celebrity,Culture
An unexpected place of healing,Culture
An ode to envy,Culture
An illustrated journey through Rome,Culture
An escape from poverty,Culture
America's native prisoners of war,Culture
All it takes is 10 mindful minutes,Culture
Agile programming -- for your family,Culture
After your final status update,Culture
Adventures in Twitter fiction,Culture
Addicted to risk,Culture
A vision for sustainable restaurants,Culture
"A tour of Nollywood, Nigeria's booming film industry",Culture
A song of the city,Culture
A short intro to the Studio School,Culture
"A Saudi, an Indian and an Iranian walk into a Qatari bar ...",Culture
A Saudi woman who dared to drive,Culture
A radical experiment in empathy,Culture
A police chief with a difference,Culture
A plea for education,Culture
A plant's-eye view,Culture
A philosophical quest for our biggest problems,Culture
A parable for Kenya,Culture
A one-woman global village,Culture
A new vision for rebuilding Detroit,Culture
A memorial at Ground Zero,Culture
"A master architect asks, Now what?",Culture
"A manifesto for play, for Bulgaria and beyond",Culture
A little-told tale of sex and sensuality,Culture
A life of purpose,Culture
A life lesson from a volunteer firefighter,Culture
"A kinder, gentler philosophy of success",Culture
A guerilla gardener in South Central LA,Culture
A global culture to fight extremism,Culture
A family tree for humanity,Culture
A doctor's touch,Culture
A Darwinian theory of beauty,Culture
A comic sendup of TED2006,Culture
A circle of caring,Culture
A child of the state,Culture
A call to men,Culture
8 secrets of success,Culture
7 ways games reward the brain,Culture
5 ways to listen better,Culture
3 ways to speak English,Culture
3 clues to understanding your brain,Culture
2600 years of history in one object,Culture
10 top time-saving tech tips,Culture
10 things you didn't know about orgasm,Culture
(Re)touching lives through photos,Culture
"""Tembererana""",Culture
"""Clonie""",Culture
"""Black Men Ski""",Culture
Why we need the explorers,Curiosity
We are makers,Curiosity
Play! Experiment! Discover!,Curiosity
Photographs of secret sites,Curiosity
My journey in design,Curiosity
We are all cyborgs now,Cyborg
I listen to color,Cyborg
Who am I? Think again,Dance
"The new bionics that let us run, climb and dance",Dance
Teach arts and sciences together,Dance
"Smash fear, learn anything",Dance
Nerdcore comedy,Dance
My magic moves,Dance
My journey to yo-yo mastery,Dance
Juggling as art ... and science,Dance
"It's TED, the Musical",Dance
"In the Internet age, dance evolves ...",Dance
How to start a movement,Dance
How schools kill creativity,Dance
Fighting cancer with dance,Dance
Dancing with light,Dance
"Dance vs. powerpoint, a modest proposal",Dance
Dance to change the world,Dance
A father-daughter dance ... in prison,Dance
A choreographer's creative process in real time,Dance
"What we can learn from galaxies far, far away",Dark matter
The sound the universe makes,Dark matter
The hunt for a supermassive black hole,Dark matter
The design of the universe,Dark matter
Shedding light on dark matter,Dark matter
Your phone company is watching,Data
Why smart statistics are the key to fighting crime,Data
Who controls the world?,Data
What we learned from 5 million books,Data
Visualizing the medical data explosion,Data
Visualizing ourselves ... with crowd-sourced data,Data
Use data to build better schools,Data
Three types of online attack,Data
The surprising seeds of a big-data revolution in healthcare,Data
The surprising need for strangeness,Data
The rise of human-computer cooperation,Data
The ocean's shifting baseline,Data
The magic washing machine,Data
"The hunt for ""unexpected genetic heroes""",Data
The Happy Planet Index,Data
The good news of the decade?,Data
The curly fry conundrum: Why social media ¡°likes¡± say more than you might think,Data
The beauty of data visualization,Data
The attitudes that sparked Arab Spring,Data
Taking imagination seriously,Data
Religions and babies,Data
Own your body's data,Data
Meet e-Patient Dave,Data
Mapping ideas worth spreading,Data
Is Pivot a turning point for web exploration?,Data
Information is food,Data
How I hacked online dating,Data
How economic inequality harms societies,Data
How can Formula 1 racing help ... babies?,Data
"Global population growth, box by box",Data
"FBI, here I am!",Data
Demand a more open-source government,Data
Could your language affect your ability to save money?,Data
Big data is better data,Data
Battling bad science,Data
Art made of storms,Data
A reality check on renewables,Data
What fear can teach us,Death
We need a heroic narrative for death,Death
Two poems about what dogs think (probably),Death
The 4 stories we tell ourselves about death,Death
Prepare for a good end of life,Death
On technology and faith,Death
My mushroom burial suit,Death
Life that doesn't end with death,Death
Let's talk about dying,Death
Lessons from death row inmates,Death
Compassion and the true meaning of empathy,Death
Before I die I want to...,Death
A memorial at Ground Zero,Death
¡°Am I dying?¡± The honest answer.,Death
Why we shouldn't trust markets with our civic life,Debate
The quantified self,Decision-making
The paradox of choice,Decision-making
The battle between your present and future self,Decision-making
The art of choosing,Decision-making
Sometimes it's good to give up the driver's seat,Decision-making
How to make hard choices,Decision-making
How to make choosing easier,Decision-making
Don't regret regret,Decision-making
Are we in control of our own decisions?,Decision-making
"The weird, wonderful world of bioluminescence",Deextinction
The dawn of de-extinction. Are you ready?,Deextinction
It's time to question bio-engineering,Deextinction
"How we'll resurrect the gastric brooding frog, the Tasmanian tiger",Deextinction
"For more wonder, rewild the world",Deextinction
Bring back the woolly mammoth!,Deextinction
Tour the solar system from home,Demo
The thrilling potential of SixthSense technology,Demo
The search for the true face of Leonardo,Demo
The radical promise of the multi-touch interface,Demo
The levitating superconductor,Demo
The best stats you've ever seen,Demo
The art of bow-making,Demo
"Spore, birth of a game",Demo
"Robots that ""show emotion""",Demo
Rethink the desktop with BumpTop,Demo
One very dry demo,Demo
Nerdcore comedy,Demo
Nature vs. humans,Demo
"My creations, a new form of life",Demo
Meet the SixthSense interaction,Demo
"Luke, a new prosthetic arm for soldiers",Demo
Is Pivot a turning point for web exploration?,Demo
Inventing instruments that unlock new music,Demo
Image recognition that triggers augmented reality,Demo
How to tie your shoes,Demo
How to make filthy water drinkable,Demo
How PhotoSynth can connect the world's images,Demo
"Global population growth, box by box",Demo
Free or cheap Wii Remote hacks,Demo
Eco-friendly drywall,Demo
Demo: The Orb,Demo
"Building ""self-aware"" robots",Demo
Animate characters by evolving them,Demo
A preview of the WorldWide Telescope,Demo
A next-generation digital book,Demo
A new kind of music video,Demo
A look inside the brain in real time,Demo
"A ""self-healing"" asphalt",Demo
"5 predictions, from 1984",Demo
Why ordinary people need to understand power,Democracy
Why Libya's revolution didn't work -- and what might,Democracy
Why I love a country that once betrayed me,Democracy
Why democracy matters,Democracy
"We the People, and the Republic we must reclaim",Democracy
The unstoppable walk to political reform,Democracy
The lost art of democratic debate,Democracy
Politics and religion are technologies,Democracy
Political change with pen and paper,Democracy
My battle to expose government corruption,Democracy
Is China the new idol for emerging economies?,Democracy
Inside the Egyptian revolution,Democracy
Imagine a European democracy without borders,Democracy
Filming democracy in Ghana,Democracy
Faith versus tradition in Islam,Democracy
E-voting without fraud,Democracy
"Does the media have a ""duty of care""?",Democracy
Does democracy stifle economic growth?,Democracy
Demand a more open-source government,Democracy
Can democracy exist without trust?,Democracy
A tale of two political systems,Democracy
A global culture to fight extremism,Democracy
Toward a new understanding of mental illness,Depression
The year I was homeless,Depression
The power of vulnerability,Depression
The bridge between suicide and life,Depression
"Parkinson's, depression and the switch that might turn them off",Depression
On being just crazy enough,Depression
Mental health for all by involving all,Depression
How the worst moments in our lives make us who we are,Depression
How electroshock therapy changed me,Depression
His and hers ¡¦ healthcare,Depression
"Depression, the secret we share",Depression
Confessions of a depressed comic,Depression
Bringing peace to the minds of Afghanistan,Depression
Break the silence for suicide attempt survivors,Depression
Your body is my canvas,Design
Why work doesn't happen at work,Design
Why we should build wooden skyscrapers,Design
Why light needs darkness,Design
Why I brought Pac-Man to MoMA,Design
Why Google Glass?,Design
Why buses represent democracy in action,Design
Why architects need to use their ears,Design
When ideas have sex,Design
What your designs say about you,Design
What we learned from 5 million books,Design
We're covered in germs. Let's design for that.,Design
Wearing nothing new,Design
We are makers,Design
We are all designers,Design
Ways of seeing,Design
Visualizing the wonder of a living cell,Design
Visualizing ourselves ... with crowd-sourced data,Design
Visual illusions that show how we (mis)think,Design
Using nature's genius in architecture,Design
Using design to make ideas new,Design
Unintended consequences,Design
Turning trash into toys for learning,Design
Turning dunes into architecture,Design
Treat design as art,Design
Toys and materials from the future,Design
Toy tiles that talk to each other,Design
Toward a science of simplicity,Design
Tour Microsoft's Virtual Earth,Design
"To create for the ages, let's combine art and engineering",Design
Tidying up art,Design
This is Saturn,Design
This is beatjazz,Design
The world's first charter city?,Design
The world needs all kinds of minds,Design
The wonder of Zulu wire art,Design
The Web's secret stories,Design
The Web as a city,Design
The walkable city,Design
The visual magic of comics,Design
The universal anesthesia machine,Design
The thrilling potential of SixthSense technology,Design
The technology of storytelling,Design
The story of life in photographs,Design
The story behind the Mars Rovers,Design
The sticky wonder of gecko feet,Design
The shareable future of cities,Design
The shape-shifting future of the mobile phone,Design
"The secrets of nature's grossest creatures, channeled into robots",Design
The search for the true face of Leonardo,Design
The route to a sustainable future,Design
The rise of personal robots,Design
The refugees of boom-and-bust,Design
The real future of space exploration,Design
The radical promise of the multi-touch interface,Design
The quantified self,Design
The power of time off,Design
The potential of regenerative medicine,Design
The playful search for beauty,Design
The next web,Design
The museum of you,Design
The math and magic of origami,Design
The magic of truth and lies (and iPods),Design
The Long Now,Design
The invention that unlocked a locked-in artist,Design
The illustrated woman,Design
The hidden light of Afghanistan,Design
The ghastly tragedy of the suburbs,Design
The genius puppetry behind War Horse,Design
The genesis of Google,Design
The future of cars,Design
The fractals at the heart of African designs,Design
The emotion behind invention,Design
The emergent genius of ant colonies,Design
"The emergence of ""4D printing""",Design
The design of the universe,Design
The design genius of Charles + Ray Eames,Design
The cheap all-terrain wheelchair,Design
The business logic of sustainability,Design
The Blur Building and other tech-empowered architecture,Design
The bio-future of joint replacement,Design
The best computer interface? Maybe ... your hands,Design
The beauty of data visualization,Design
The beautiful math of coral,Design
The art of the eco-mindshift,Design
The art of puzzles,Design
The anthropology of mobile phones,Design
The ancient ingenuity of water harvesting,Design
"The Airstream, restyled",Design
The $80 prosthetic knee that's changing lives,Design
Teaching with the World Peace Game,Design
Teaching design for change,Design
Tales of ice-bound wonderlands,Design
Tales of creativity and play,Design
Taking OLPC to Colombia,Design
Taking imagination seriously,Design
Take Turns,Design
Sweat the small stuff,Design
"Surgery's past, present and robotic future",Design
"Spore, birth of a game",Design
Simplifying complexity,Design
Simple designs to save a life,Design
"Silk, the ancient material of the future",Design
Shh! Sound health in 8 steps,Design
Shake up your story,Design
Sculpting waves in wood and time,Design
Science-inspired design,Design
"Scenes from ""My Architect""",Design
Saving faces: A facial surgeon's craft,Design
Robots will invade our lives,Design
"Robots that ""show emotion""",Design
Robots inspired by cockroach ingenuity,Design
Reviving New York's rivers -- with oysters!,Design
Retrofitting suburbia,Design
Rethinking the way we sit down,Design
Reach into the computer and grab a pixel,Design
"Post-crash, investing in a better world",Design
Pointing to the future of UI,Design
"Playtime with Pleo, your robotic dinosaur friend",Design
Playing with space and light,Design
Play with smart materials,Design
Photos of endangered cultures,Design
Photographing the landscape of oil,Design
Paper beats plastic? How to rethink environmental folklore,Design
Our next giant leap,Design
"Organic design, inspired by nature",Design
Organic algorithms in architecture,Design
"One Laptop per Child, two years on",Design
One Laptop per Child,Design
New York's streets? Not so mean any more,Design
Nature vs. humans,Design
My wish: Once Upon a School,Design
My wish: Manufactured landscapes and green education,Design
My wish: A call for open-source architecture,Design
My mushroom burial suit,Design
My life in typefaces,Design
My library of human imagination,Design
My journey in design,Design
My green school dream,Design
My dream of a flying car,Design
My days as a young rebel,Design
"My creations, a new form of life",Design
My 5 lives as an artist,Design
My 12 pairs of legs,Design
Moving sculpture,Design
Moving photos of extreme drug-resistant TB,Design
Model rocketry,Design
Military robots and the future of war,Design
Metal that breathes,Design
"Memes and ""temes""",Design
Meet the Water Canary,Design
Meet the SixthSense interaction,Design
Meet the founder of the blog revolution,Design
"Meet Rezero, the dancing ballbot",Design
"Meet Milo, the virtual boy",Design
Medicine's future? There's an app for that,Design
Making sound visible through cymatics,Design
Making sense of maps,Design
"Making maps to fight disaster, build economies",Design
Making a car for blind drivers,Design
Let's go all-in on selling sustainability,Design
Lessons from fashion's free culture,Design
"Less stuff, more happiness",Design
Legos for grownups,Design
Learning from the gecko's tail,Design
It's time to redesign medical data,Design
Israel and Iran: A love story?,Design
Inventing instruments that unlock new music,Design
Intricate beauty by design,Design
Ingenuity and elegance in ancient African alphabets,Design
Ingenious homes in unexpected places,Design
Image recognition that triggers augmented reality,Design
I listen to color,Design
Hypersonic sound and other inventions,Design
Human-centered design,Design
Human exoskeletons -- for war and healing,Design
How to reinvent the apartment building,Design
How to reduce poverty? Fix homes,Design
How to make filthy water drinkable,Design
How to build your creative confidence,Design
"How to ""sketch"" with electronics",Design
"How the ""ghost map"" helped end a killer disease",Design
How technology allowed me to read,Design
How pig parts make the world turn,Design
How photography connects us,Design
How low-cost eye care can be world-class,Design
"How I learned to stop worrying and love ""useless"" art",Design
How I built a windmill,Design
How I built a toaster -- from scratch,Design
How I became 100 artists,Design
"How giant websites design for you (and a billion others, too)",Design
How can technology transform the human body?,Design
How beauty feels,Design
"How art, technology and design inform creative leaders",Design
How art gives shape to cultural change,Design
How architecture can connect us,Design
How architectural innovations migrate across borders,Design
How a boy became an artist,Design
Happiness by design,Design
Half a million secrets,Design
Grow your own clothes,Design
"Great design is serious, not solemn",Design
Great cars are great art,Design
Glowing life in an underwater world,Design
Glorious visions in animation and performance,Design
Gaming can make a better world,Design
Games for girls,Design
Free or cheap Wii Remote hacks,Design
Four ways to fix a broken legal system,Design
"Forget multitasking, try monotasking",Design
Fly with the Jetman,Design
Fashion and creativity,Design
Extreme wingsuit flying,Design
E-voting without fraud,Design
Everyday inventions,Design
Eco-friendly drywall,Design
"Don't build your home, grow it!",Design
Do the green thing,Design
DJ decks made of... paper,Design
Designing with slogans,Design
Designing objects that tell stories,Design
Designing for simplicity,Design
"Designing books is no laughing matter. OK, it is.",Design
Designers -- think big!,Design
"Design, explained.",Design
Design with the blind in mind,Design
Design is in the details,Design
"Design for people, not awards",Design
Design for all 5 senses,Design
Design and the Elastic Mind,Design
Design and discovery,Design
Design and destiny,Design
Demo: The Orb,Design
Creative houses from reclaimed stuff,Design
Cradle to cradle design,Design
Cooking as never seen before,Design
Conception to birth -- visualized,Design
"Claim your ""manspace""",Design
"Cheap, effective shelter for disaster relief",Design
Changing my legs - and my mindset,Design
Capturing memories in video art,Design
Can we make things that make themselves?,Design
Can design save newspapers?,Design
Building uniqueness,Design
Building unimaginable shapes,Design
Building the Seed Cathedral,Design
Building a theater that remakes itself,Design
Building a museum of museums on the web,Design
"Building ""self-aware"" robots",Design
"Build a tower, build a team",Design
Brilliant designs to fit more people in every city,Design
Breakthrough designs for ultra-low-cost products,Design
Biomimicry's surprising lessons from nature's engineers,Design
Biomimicry in action,Design
Behind the design of Seattle's library,Design
Augmented-reality maps,Design
"Art with wire, sugar, chocolate and string",Design
Art that looks back at you,Design
Art of substance and absence,Design
Are games better than life?,Design
Architecture that senses and responds,Design
Architecture that repairs itself?,Design
Architecture for the people by the people,Design
Architecture at home in its community,Design
Anti-gravity sculpture,Design
Animating a photo-real digital face,Design
Animate characters by evolving them,Design
Anatomy of a New Yorker cartoon,Design
An illustrated journey through Rome,Design
A warm embrace that saves lives,Design
A tour of modern architecture,Design
A thought experiment on the intelligence of crows,Design
A supercharged motorcycle design,Design
A story of mixed emoticons,Design
A song of the city,Design
A short intro to the Studio School,Design
A shark-deterrent wetsuit (and it's not what you think),Design
A robot that flies like a bird,Design
"A prosthetic arm that ""feels""",Design
A primer on 3D printing,Design
A powerful idea about ideas,Design
A plug for smart power outlets,Design
A plane you can drive,Design
A next-generation digital book,Design
A new kind of music video,Design
A monkey economy as irrational as ours,Design
A mobile fridge for vaccines,Design
A memorial at Ground Zero,Design
"A master architect asks, Now what?",Design
A magical tale (with augmented reality),Design
A hospital tour in Nigeria,Design
A history of the universe in sound,Design
A headset that reads your brainwaves,Design
A garden in my apartment,Design
A future beyond traffic gridlock,Design
A free digital library,Design
A flight through the ocean,Design
A flight on solar wings,Design
A Darwinian theory of beauty,Design
A computer that works like the brain,Design
A cello with many voices,Design
A 3D-printed jumbo jet?,Design
7 rules for making more happiness,Design
6 ways mushrooms can save the world,Design
"5 predictions, from 1984",Design
5 dangerous things you should let your kids do,Design
3 ways to (usefully) lose control of your brand,Design
3 ways the brain creates meaning,Design
3 ways good design makes you happy,Design
3 warp-speed architecture tales,Design
17 words of architectural inspiration,Design
10 young Indian artists to watch,Design
1.3m reasons to re-invent the syringe,Design
World-class health care,Development
What nonprofits can learn from Coca-Cola,Development
We need to feed the whole world,Development
Want to help someone? Shut up and listen!,Development
The hidden world of shadow cities,Development
The good news of the decade?,Development
The child-driven education,Development
The cheap all-terrain wheelchair,Development
The best stats you've ever seen,Development
"The ""bottom billion""",Development
Teaching one child at a time,Development
Patient capitalism,Development
Our century's greatest injustice,Development
New insights on poverty,Development
Navigating our global future,Development
Meet the Water Canary,Development
Life lessons through tinkering,Development
Let's crowdsource the world's goals,Development
Let my dataset change your mindset,Development
Learning from a barefoot movement,Development
Invest in Africa's own solutions,Development
Ideas for India's future,Development
How to rebuild a broken state,Development
How open data is changing international aid,Development
How mobile phones can fight poverty,Development
Exploring the mind of a killer,Development
Escaping the Khmer Rouge,Development
Architecture that repairs itself?,Development
An economic reality check,Development
Aid versus trade,Development
Aid for Africa? No thanks.,Development
Africa's cheetahs versus hippos,Development
Adjustable liquid-filled eyeglasses,Development
A third way to think about aid,Development
A lab the size of a postage stamp,Development
A girl who demanded school,Development
A bath without water,Development
4 environmental 'heresies',Development
1.3m reasons to re-invent the syringe,Development
Where are the baby dinosaurs?,Dinosaurs
Why I live in mortal dread of public speaking,Disability
There are no scraps of men,Disability
The cheap all-terrain wheelchair,Disability
Meet the robots for humanity,Disability
In the key of genius,Disability
In search of the man who broke my neck,Disability
"I¡¯m not your inspiration, thank you very much",Disability
Human exoskeletons -- for war and healing,Disability
How technology allowed me to read,Disability
Embrace the shake,Disability
Deep sea diving ... in a wheelchair,Disability
A word game to communicate in any language,Disability
Why would God create a tsunami?,Disaster relief
Why stay in Chernobyl? Because it's home.,Disaster relief
The political chemistry of oil,Disaster relief
"The oil spill's unseen culprits, victims",Disaster relief
Reporting crisis via texting,Disaster relief
"One seed at a time, protecting the future of food",Disaster relief
My wish: A call for open-source architecture,Disaster relief
How to step up in the face of disaster,Disaster relief
Haiti's disaster of engineering,Disaster relief
Global priorities bigger than climate change,Disaster relief
Emergency shelters made from paper,Disaster relief
Digital humanitarianism,Disaster relief
"Cheap, effective shelter for disaster relief",Disaster relief
A new mission for veterans -- disaster relief,Disaster relief
A memorial at Ground Zero,Disaster relief
(Re)touching lives through photos,Disaster relief
We need better drugs -- now,Disease
The wireless future of medicine,Disease
The killer American diet that's sweeping the planet,Disease
The jungle search for viruses,Disease
The invention that unlocked a locked-in artist,Disease
"The hunt for ""unexpected genetic heroes""",Disease
The face of AIDS in Africa,Disease
Science-inspired design,Disease
Re-engineering mosquitos to fight disease,Disease
My wish: Three unusual medical inventions,Disease
My wish: Help me stop pandemics,Disease
Meet the future of cancer research,Disease
Let's treat violence like a contagious disease,Disease
How we'll stop polio for good,Disease
How I'm preparing to get Alzheimer's,Disease
"How bacteria ""talk""",Disease
HIV -- new facts and stunning data visuals,Disease
Could this laser zap malaria?,Disease
Could the sun be good for your heart?,Disease
Can we domesticate germs?,Disease
A theory of Earth's mass extinctions,Disease
A test for Parkinson's with a phone call,Disease
A roadmap to end aging,Disease
A promising test for pancreatic cancer ... from a teenager,Disease
A plea for bees,Disease
A next-gen cure for killer infections,Disease
A map of the brain,Disease
A lab the size of a postage stamp,Disease
3 reasons we still haven¡¯t gotten rid of malaria,Disease
Welcome to the genomic revolution,DNA
"Watch me unveil ""synthetic life""",DNA
Using nature to grow batteries,DNA
The life code that will reshape the future,DNA
Sampling the ocean's DNA,DNA
Playing with DNA that self-assembles,DNA
Play! Experiment! Discover!,DNA
"Organic design, inspired by nature",DNA
My DNA vending machine,DNA
How we discovered DNA,DNA
"DNA folding, in detail",DNA
