title,Root_topic
You are the future of philanthropy,Activism
World-class health care,Activism
Why I must come out,Activism
Why I am an HIV/AIDS activist,Activism
Why giving away our wealth has been the most satisfying thing we've done,Activism
What's so funny about mental illness?,Activism
What the gay rights movement learned from the civil rights movement,Activism
What security means to me,Activism
Want to be an activist? Start with your toys,Activism
Walk the earth ... my 17-year vow of silence,Activism
The tragedy of orphanages,Activism
The silent drama of photography,Activism
The shocking move to criminalize nonviolent protest,Activism
The opportunity of adversity,Activism
"The good news on poverty (Yes, there's good news)",Activism
The fight to end rare-animal trafficking in Brazil,Activism
The face of AIDS in Africa,Activism
The case for anonymity online,Activism
"The ""bottom billion""",Activism
Texting that saves lives,Activism
"Suddenly, my body",Activism
Reporting crisis via texting,Activism
"Rebuilding a neighborhood with beauty, dignity, hope",Activism
Photos of endangered cultures,Activism
"One Laptop per Child, two years on",Activism
One day of peace,Activism
New thinking on the climate crisis,Activism
My wish: Use art to turn the world inside out,Activism
My wish: Three actions for Africa,Activism
My wish: Protect our oceans,Activism
My wish: Once Upon a School,Activism
My wish: Let my photographs bear witness,Activism
My wish: A call for open-source architecture,Activism
My mind-shifting Everest swim,Activism
My 12 pairs of legs,Activism
Looking past limits,Activism
"I¡¯m not your inspiration, thank you very much",Activism
"How we rescued the ""dancing"" bears""",Activism
How to topple a dictator,Activism
"How I brought a river, and my city, back to life",Activism
How I became an activist,Activism
How cults rewire the brain,Activism
Hackers: the Internet's immune system,Activism
Greening the ghetto,Activism
Find your voice against gender violence,Activism
Fighting with nonviolence,Activism
Fight injustice with raw video,Activism
Conserving the canopy,Activism
Coding a better government,Activism
Building a park in the sky,Activism
Between music and medicine,Activism
An escape from poverty,Activism
Addicted to risk,Activism
A realistic vision for world peace,Activism
A hospital tour in Nigeria,Activism
A hero of the Congo forest,Activism
A girl who demanded school,Activism
A father-daughter dance ... in prison,Activism
A call to reinvent liberal arts education,Activism
"""Women of Hope""",Activism
"""Thula Mama""",Activism
Why stay in Chernobyl? Because it's home.,Adventure
Why I'm rowing across the Pacific,Adventure
Why I love vultures,Adventure
What I learned from going blind in space,Adventure
The power of time off,Adventure
The astonishing hidden world of the deep ocean,Adventure
Photographs of secret sites,Adventure
My underwater robot,Adventure
My solar-powered adventure,Adventure
My mind-shifting Everest swim,Adventure
Medical miracle on Everest,Adventure
Life in Biosphere 2,Adventure
I'm going to the moon. Who's with me?,Adventure
How I swam the North Pole,Adventure
How global crime networks work,Adventure
Fly with the Jetman,Adventure
Extreme wingsuit flying,Adventure
Escaping the Khmer Rouge,Adventure
Before Avatar ... a curious boy,Adventure
9 life lessons from rock climbing,Adventure
The secret of the bat genome,Advertising
The post-crisis consumer,Advertising
Social media and the end of gender,Advertising
Perspective is everything,Advertising
Life lessons from an ad man,Advertising
Bitcoin. Sweat. Tide. Meet the future of branded currency.,Advertising
Beware neuro-bunk,Advertising
You don't need an app for that,Africa
World-class health care,Africa
Why invest in Africa,Africa
Why I am an HIV/AIDS activist,Africa
What separates us from chimpanzees?,Africa
What I learned from Nelson Mandela,Africa
Turning dunes into architecture,Africa
The wonder of Zulu wire art,Africa
The thinking behind 50x15,Africa
The story of Ezra,Africa
The search for humanity's roots,Africa
The path to ending ethnic conflicts,Africa
The link between unemployment and terrorism,Africa
The jungle search for viruses,Africa
The good news of the decade?,Africa
The fractals at the heart of African designs,Africa
The face of AIDS in Africa,Africa
The danger of a single story,Africa
The best stats you've ever seen,Africa
"The ""bottom billion""",Africa
Telling stories from Africa,Africa
Selling condoms in the Congo,Africa
Reporting crisis via texting,Africa
On humanity,Africa
New insights on poverty,Africa
My wish: Three actions for Africa,Africa
My wish: Rebuilding Rwanda,Africa
My wish: Find the next Einstein in Africa,Africa
Mothers helping mothers fight HIV,Africa
"Meet BRCK, Internet access built for Africa",Africa
Life lessons from big cats,Africa
Is China the new idol for emerging economies?,Africa
Invest in Africa's own solutions,Africa
How to educate leaders? Liberal arts,Africa
How to build with clay... and community,Africa
How poachers became caretakers,Africa
How I taught rats to sniff out land mines,Africa
"How I named, shamed and jailed",Africa
How I harnessed the wind,Africa
How I built a windmill,Africa
How I became an activist,Africa
How humans and animals can live together,Africa
HIV -- new facts and stunning data visuals,Africa
Global priorities bigger than climate change,Africa
Flip your thinking on AIDS in Africa,Africa
Filming democracy in Ghana,Africa
Digging up dinosaurs,Africa
Demand a fair trade cell phone,Africa
"Crop insurance, an idea worth seeding",Africa
Architecture at home in its community,Africa
Aid for Africa? No thanks.,Africa
Africa's next boom,Africa
Africa's cheetahs versus hippos,Africa
"A tour of Nollywood, Nigeria's booming film industry",Africa
A third way to think about aid,Africa
A parable for Kenya,Africa
A hero of the Congo forest,Africa
A girl who demanded school,Africa
A family tree for humanity,Africa
A dig for humanity's origins,Africa
A bath without water,Africa
"""Thula Mama""",Africa
Your genes are not your fate,Aging
Why 30 is not the new 20,Aging
The coming neurological epidemic,Aging
Prepare for a good end of life,Aging
Older people are happier,Aging
"Never, ever give up",Aging
Life's third act,Aging
How to live passionately?no matter your age,Aging
How state budgets are breaking US schools,Aging
How societies can grow old better,Aging
How I'm preparing to get Alzheimer's,Aging
How Benjamin Button got his face,Aging
Experiments that hint of longer lives,Aging
An unexpected place of healing,Aging
A roadmap to end aging,Aging
Why not eat insects?,Agriculture
What's wrong with our food system,Agriculture
The other inconvenient truth,Agriculture
"One seed at a time, protecting the future of food",Agriculture
Natural pest control ... using bugs!,Agriculture
My invention that made peace with lions,Agriculture
Let the environment guide our development,Agriculture
How we can eat our landscapes,Agriculture
How to fight desertification and reverse climate change,Agriculture
How I fell in love with a fish,Agriculture
Energy from floating algae pods,Agriculture
Design with the blind in mind,Agriculture
"Crop insurance, an idea worth seeding",Agriculture
Cooking as alchemy,Agriculture
A simple solution to the coming phosphorus crisis,Agriculture
A guerilla gardener in South Central LA,Agriculture
A country with no water,Agriculture
Where¡¯s Google going next?,AI
The rise of personal robots,AI
The rise of human-computer cooperation,AI
Silicon-based comedy,AI
"Robots with ""soul""",AI
Robots will invade our lives,AI
Robots that fly ... and cooperate,AI
My seven species of robot,AI
"Meet Milo, the virtual boy",AI
How brain science will change computing,AI
Get ready for hybrid thinking,AI
"Connected, but alone?",AI
"Building ""self-aware"" robots",AI
4 lessons from robots about being human,AI
Why I am an HIV/AIDS activist,AIDS
The jungle search for viruses,AIDS
The face of AIDS in Africa,AIDS
"Sex, drugs and HIV -- let's get rational",AIDS
My wish: Three actions for Africa,AIDS
Mothers helping mothers fight HIV,AIDS
HIV and flu -- the vaccine strategy,AIDS
HIV -- new facts and stunning data visuals,AIDS
HIV -- how to fight an epidemic of bad laws,AIDS
Global priorities bigger than climate change,AIDS
Flip your thinking on AIDS in Africa,AIDS
Ethical riddles in HIV research,AIDS
The real future of space exploration,Aircraft
My solar-powered adventure,Aircraft
"Life at 30,000 feet",Aircraft
The rise of human-computer cooperation,Algorithm
Mapping ideas worth spreading,Algorithm
How I hacked online dating,Algorithm
Building unimaginable shapes,Algorithm
What comes after An Inconvenient Truth?,Alternative energy
Using nature to grow batteries,Alternative energy
The route to a sustainable future,Alternative energy
The missing link to renewable energy,Alternative energy
The ghastly tragedy of the suburbs,Alternative energy
The future of cars,Alternative energy
Simple designs to save a life,Alternative energy
Planning for the end of oil,Alternative energy
On the verge of creating synthetic life,Alternative energy
Let's transform energy -- with natural gas,Alternative energy
How synchronized hammer strikes could generate nuclear fusion,Alternative energy
How mobile phones can fight poverty,Alternative energy
How I built a windmill,Alternative energy
High-altitude wind energy from kites!,Alternative energy
Fusion is energy's future,Alternative energy
Energy from floating algae pods,Alternative energy
Averting the climate crisis,Alternative energy
A reality check on renewables,Alternative energy
A new ecosystem for electric cars,Alternative energy
A flight on solar wings,Alternative energy
A 40-year plan for energy,Alternative energy
4 environmental 'heresies',Alternative energy
Tracking ancient diseases using ... plaque,Ancient world
"To create for the ages, let's combine art and engineering",Ancient world
The unheard story of David and Goliath,Ancient world
Revealing the lost codex of Archimedes,Ancient world
How food shapes our cities,Ancient world
An illustrated journey through Rome,Ancient world
A new way to explain explanation,Ancient world
A dig for humanity's origins,Ancient world
Why I love vultures,Animals
What separates us from chimpanzees?,Animals
"Unseen footage, untamed nature",Animals
Underwater astonishments,Animals
Two poems about what dogs think (probably),Animals
The world needs all kinds of minds,Animals
The voice of the natural world,Animals
The toxic baby,Animals
The story of life in photographs,Animals
The smelly mystery of the human pheromone,Animals
The shocking move to criminalize nonviolent protest,Animals
"The secrets of nature's grossest creatures, channeled into robots",Animals
The secret of the bat genome,Animals
The real danger lurking in the water,Animals
The intriguing sound of marine mammals,Animals
The interspecies internet? An idea in progress,Animals
The great penguin rescue,Animals
The gentle genius of bonobos,Animals
The genius puppetry behind War Horse,Animals
The dance of the dung beetle,Animals
The camel's hump,Animals
The birds and the bees are just the beginning,Animals
The astonishing hidden world of the deep ocean,Animals
Tales of ice-bound wonderlands,Animals
Swim with the giant sunfish,Animals
Robots inspired by cockroach ingenuity,Animals
Re-engineering mosquitos to fight disease,Animals
"Puppies! Now that I¡¯ve got your attention, complexity theory",Animals
Pay attention to penguins,Animals
My obsession with objects and the stories they tell,Animals
"My creations, a new form of life",Animals
Moral behavior in animals,Animals
Life lessons from big cats,Animals
Life in the deep oceans,Animals
Learning from the gecko's tail,Animals
Learning from Sherman the shark,Animals
"How we'll resurrect the gastric brooding frog, the Tasmanian tiger",Animals
"How we rescued the ""dancing"" bears""",Animals
How to restore a rainforest,Animals
How to make a splash in social media,Animals
How poachers became caretakers,Animals
How photography connects us,Animals
How I taught rats to sniff out land mines,Animals
How humans and animals can live together,Animals
Glowing life in an underwater world,Animals
"For more wonder, rewild the world",Animals
Fighting a contagious cancer,Animals
"Evolution's gift of play, from bonobo apes to humans",Animals
Every city needs healthy honey bees,Animals
Dog-friendly dog training,Animals
Digging up dinosaurs,Animals
"Depressed dogs, cats with OCD ? what animal madness means for us humans",Animals
"Cute, sexy, sweet, funny",Animals
Could we speak the language of dolphins?,Animals
Conserving the canopy,Animals
Bring back the woolly mammoth!,Animals
Biomimicry's surprising lessons from nature's engineers,Animals
"Archeology, animal photography, BBQ ...",Animals
Animate characters by evolving them,Animals
A thought experiment on the intelligence of crows,Animals
"A talking, squawking parrot",Animals
A robot that flies like a bird,Animals
A plea for bees,Animals
A plant's-eye view,Animals
A mouse. A laser beam. A manipulated memory.,Animals
A hero of the Congo forest,Animals
A drone's-eye view of conservation,Animals
"""The Dog Song""",Animals
What I discovered in New York City  trash,Anthropology
We are all cyborgs now,Anthropology
The worldwide web of belief and ritual,Anthropology
The search for humanity's roots,Anthropology
Skin color is an illusion,Anthropology
In search of the man who broke my neck,Anthropology
How the Internet enables intimacy,Anthropology
Dreams from endangered cultures,Anthropology
Curating humanity's heritage,Anthropology
Bring back the woolly mammoth!,Anthropology
A family tree for humanity,Anthropology
A dig for humanity's origins,Anthropology
"What ants teach us about the brain, cancer and the Internet",Ants
The emergent genius of ant colonies,Ants
My wish: Build the Encyclopedia of Life,Ants
The gentle genius of bonobos,Apes
I believe we evolved from aquatic apes,Apes
A dig for humanity's origins,Apes
Why we should build wooden skyscrapers,Architecture
Why light needs darkness,Architecture
Why architects need to use their ears,Architecture
We're covered in germs. Let's design for that.,Architecture
Using nature's genius in architecture,Architecture
Turning dunes into architecture,Architecture
"To create for the ages, let's combine art and engineering",Architecture
The shareable future of cities,Architecture
The Long Now,Architecture
The ghastly tragedy of the suburbs,Architecture
The fractals at the heart of African designs,Architecture
The Blur Building and other tech-empowered architecture,Architecture
The ancient ingenuity of water harvesting,Architecture
"Symmetry, reality's riddle",Architecture
"Scenes from ""My Architect""",Architecture
Reviving New York's rivers -- with oysters!,Architecture
New York's streets? Not so mean any more,Architecture
My wish: A call for open-source architecture,Architecture
My green agenda for architecture,Architecture
My days as a young rebel,Architecture
Metal that breathes,Architecture
How to reinvent the apartment building,Architecture
How to reduce poverty? Fix homes,Architecture
How to grow fresh air,Architecture
How to build with clay... and community,Architecture
How public spaces make cities work,Architecture
"How I brought a river, and my city, back to life",Architecture
How can technology transform the human body?,Architecture
How architecture helped music evolve,Architecture
How architecture can connect us,Architecture
How architectural innovations migrate across borders,Architecture
Haiti's disaster of engineering,Architecture
Emergency shelters made from paper,Architecture
Eco-friendly drywall,Architecture
"Don't build your home, grow it!",Architecture
"Design, explained.",Architecture
Creative houses from reclaimed stuff,Architecture
Cradle to cradle design,Architecture
"Claim your ""manspace""",Architecture
Building uniqueness,Architecture
Building unimaginable shapes,Architecture
Building the Seed Cathedral,Architecture
Building a theater that remakes itself,Architecture
Brilliant designs to fit more people in every city,Architecture
Behind the design of Seattle's library,Architecture
Architecture that repairs itself?,Architecture
Architecture for the people by the people,Architecture
Architecture at home in its community,Architecture
A tour of modern architecture,Architecture
A plug for smart power outlets,Architecture
A park underneath the hustle and bustle of New York City,Architecture
A new museum wing ... in a giant bubble,Architecture
A memorial at Ground Zero,Architecture
"A master architect asks, Now what?",Architecture
3 warp-speed architecture tales,Architecture
17 words of architectural inspiration,Architecture
Wry photos that turn stereotypes upside down,Art
Why I brought Pac-Man to MoMA,Art
Who am I? Think again,Art
What's your 200-year plan?,Art
What is retro-futurism?,Art
What humans can learn from semi-intelligent slime,Art
Weaving narratives in museum galleries,Art
Using tech to enable dreaming,Art
Using design to make ideas new,Art
Turning powerful stats into art,Art
Treat design as art,Art
Toy tiles that talk to each other,Art
Tidying up art,Art
The wonder of Zulu wire art,Art
The web as art,Art
The visual magic of comics,Art
The story of life in photographs,Art
The story of a girl,Art
The stories behind the bloodlines,Art
The shared wonder of film,Art
The secret lives of paintings,Art
The search for the true face of Leonardo,Art
The power of time off,Art
The power of cartoons,Art
The painter and the pendulum,Art
The math and magic of origami,Art
The magic of truth and lies (and iPods),Art
The mad scientist of music,Art
The Long Now,Art
The illustrated woman,Art
The Blur Building and other tech-empowered architecture,Art
The beautiful math of coral,Art
The art of wearable communication,Art
The art of the interview,Art
The art of the eco-mindshift,Art
The art of puzzles,Art
The art and craft of bread,Art
The  4 a.m. mystery,Art
Teach arts and sciences together,Art
Tales of creativity and play,Art
Taking imagination seriously,Art
Take back your city with paint,Art
"Symmetry, reality's riddle",Art
Superheroes inspired by Islam,Art
Stunning data visualization in the AlloSphere,Art
Stories cut from paper,Art
Software (as) art,Art
Sculptures that¡¯d be at home in the deep sea,Art
Sculpting waves in wood and time,Art
Revealing the lost codex of Archimedes,Art
Playing with space and light,Art
Photographs of secret sites,Art
Photographing the hidden story,Art
Optical illusions show how we see,Art
One second every day,Art
My wish: Manufactured landscapes and green education,Art
My underground art explorations,Art
My obsession with objects and the stories they tell,Art
My DNA vending machine,Art
"My creations, a new form of life",Art
My 5 lives as an artist,Art
Moving sculpture,Art
Metaphorically speaking,Art
Metal that breathes,Art
Intricate beauty by design,Art
"In the Internet age, dance evolves ...",Art
I listen to color,Art
How YouTube thinks about copyright,Art
How to look inside the brain,Art
How to engineer a viral music video,Art
"How to ""sketch"" with electronics",Art
"How I learned to stop worrying and love ""useless"" art",Art
How I became 100 artists,Art
"How art, technology and design inform creative leaders",Art
How art gives shape to cultural change,Art
How a boy became an artist,Art
Hold your breath for micro-sculpture,Art
High-tech art (with a sense of humor),Art
Haunting photos of polar ice,Art
Happiness by design,Art
"Great design is serious, not solemn",Art
Glorious visions in animation and performance,Art
"Globalizing the local, localizing the global",Art
"FBI, here I am!",Art
Exposing the invisible,Art
"Embracing otherness, embracing myself",Art
Embrace the remix,Art
Embrace the near win,Art
Drawing on humor for change,Art
Designing with slogans,Art
Designing for simplicity,Art
Designers -- think big!,Art
Design and the Elastic Mind,Art
"Comics that ask ""what if?""",Art
Comics of bygone New York,Art
Building a museum of museums on the web,Art
"Art with wire, sugar, chocolate and string",Art
Art that looks back at you,Art
Art that craves your attention,Art
Art of substance and absence,Art
Art made of storms,Art
Architecture that repairs itself?,Art
Anti-gravity sculpture,Art
Animating a photo-real digital face,Art
An unusual glimpse at celebrity,Art
An illustrated journey through Rome,Art
A wide-angle view of fragile Earth,Art
A tour of modern architecture,Art
A new kind of music video,Art
A magical tale (with augmented reality),Art
A history of the universe in sound,Art
A glimpse of life on the road,Art
A choreographer's creative process in real time,Art
A 3D atlas of the universe,Art
4 lessons in creativity,Art
4 lessons from robots about being human,Art
10 young Indian artists to watch,Art
Your elusive creative genius,Arts
Your body is my canvas,Arts
Why I love a country that once betrayed me,Arts
Where does creativity hide?,Arts
What is retro-futurism?,Arts
We are the stories we tell ourselves,Arts
Ways of seeing,Arts
Visualizing ourselves ... with crowd-sourced data,Arts
Visual illusions that show how we (mis)think,Arts
Using nature's genius in architecture,Arts
Turning powerful stats into art,Arts
Trusting the ensemble,Arts
Treat design as art,Arts
Tidying up art,Arts
The web as art,Arts
The visual magic of comics,Arts
The true power of the performing arts,Arts
The transformative power of classical music,Arts
The story of life in photographs,Arts
The story of Ezra,Arts
The silent drama of photography,Arts
The secret lives of paintings,Arts
The playful search for beauty,Arts
The mysterious lives of giant trees,Arts
The music of a war child,Arts
The magic of truth and lies (and iPods),Arts
The life-long learner,Arts
The joyful tradition of mountain music,Arts
The journey across the high wire,Arts
The invisible man,Arts
The hidden light of Afghanistan,Arts
The genius puppetry behind War Horse,Arts
The El Sistema music revolution,Arts
The clues to a great story,Arts
The Blur Building and other tech-empowered architecture,Arts
The best computer interface? Maybe ... your hands,Arts
The arts festival revolution,Arts
The art of the eco-mindshift,Arts
The art of creating awe,Arts
The  4 a.m. mystery,Arts
Teach arts and sciences together,Arts
Taking imagination seriously,Arts
"Suddenly, my body",Arts
Stories cut from paper,Arts
Software (as) art,Arts
Singing the primal mystery,Arts
Singing after a double lung transplant,Arts
"Singing ""What I Want""",Arts
Shake up your story,Arts
"Sculpted space, within and without",Arts
Saving faces: A facial surgeon's craft,Arts
Revealing the lost codex of Archimedes,Arts
Remaking my voice,Arts
"Rebuilding a neighborhood with beauty, dignity, hope",Arts
Psychedelic science,Arts
Poetry of youth and age,Arts
"Poems of war, peace, women, power",Arts
Please don't take my Air Jordans,Arts
Playing with space and light,Arts
Photos of endangered cultures,Arts
Photos from a storm chaser,Arts
Photographs of secret sites,Arts
Pay attention to nonviolence,Arts
"Organic design, inspired by nature",Arts
One year of turning the world inside out,Arts
Nerdcore comedy,Arts
My wish: Use art to turn the world inside out,Arts
My wish: Manufactured landscapes and green education,Arts
My wish: Let my photographs bear witness,Arts
My wish: A global day of film,Arts
My underground art explorations,Arts
My mushroom burial suit,Arts
My magic moves,Arts
My journey in design,Arts
"My creations, a new form of life",Arts
My 5 lives as an artist,Arts
"Music is medicine, music is sanity",Arts
Moving sculpture,Arts
Moving photos of extreme drug-resistant TB,Arts
Letting go of God,Arts
Learning from Sherman the shark,Arts
Learning from leadership's missing manual,Arts
"Know thyself, with a brain scanner",Arts
Inside a school for suicide bombers,Arts
"In the Internet age, dance evolves ...",Arts
"Improvising on piano, aged 14",Arts
If I controlled the Internet,Arts
Human-centered design,Arts
How YouTube thinks about copyright,Arts
How to truly listen,Arts
How to engineer a viral music video,Arts
How to build your creative confidence,Arts
"How I learned to stop worrying and love ""useless"" art",Arts
How I became 100 artists,Arts
How Benjamin Button got his face,Arts
How beauty feels,Arts
"How art, technology and design inform creative leaders",Arts
How art gives shape to cultural change,Arts
How architecture helped music evolve,Arts
How architecture can connect us,Arts
How a boy became an artist,Arts
Hooked by an octopus,Arts
Hold your breath for micro-sculpture,Arts
Haunting photos of polar ice,Arts
Happiness in body and soul,Arts
Happiness by design,Arts
Half a million secrets,Arts
"Great design is serious, not solemn",Arts
Great cars are great art,Arts
Glorious visions in animation and performance,Arts
"Globalizing the local, localizing the global",Arts
Games for girls,Arts
Four American characters,Arts
Finding the story inside the painting,Arts
Fight injustice with raw video,Arts
Fiddling in reel time,Arts
"FBI, here I am!",Arts
Everyday inventions,Arts
"Embracing otherness, embracing myself",Arts
Embrace the shake,Arts
El Sistema's top youth orchestra,Arts
Different ways of knowing,Arts
Design is in the details,Arts
Deep sea diving ... in a wheelchair,Arts
Cooking as never seen before,Arts
Cloudy with a chance of joy,Arts
Casting a spell on the cello,Arts
Capturing memories in video art,Arts
Building unimaginable shapes,Arts
Building the Seed Cathedral,Arts
Building a theater that remakes itself,Arts
Building a park in the sky,Arts
Building a museum of museums on the web,Arts
Behind the design of Seattle's library,Arts
Before I die I want to...,Arts
Beats that defy boxes,Arts
"Be an artist, right now!",Arts
Art that looks back at you,Arts
Art of substance and absence,Arts
Art made of storms,Arts
Art in exile,Arts
Anti-gravity sculpture,Arts
Animations of unseeable biology,Arts
Anatomy of a New Yorker cartoon,Arts
An unusual glimpse at celebrity,Arts
An illustrated journey through Rome,Arts
