title,Root_topic
My message of peace from Pakistan,Health care
Mothers helping mothers fight HIV,Health care
Meet e-Patient Dave,Health care
Medicine's future? There's an app for that,Health care
"Luke, a new prosthetic arm for soldiers",Health care
Let's talk about dying,Health care
Let's pool our medical data,Health care
Let's crowdsource the world's goals,Health care
Lessons from the 1918 flu,Health care
Is the obesity crisis hiding a bigger problem?,Health care
Inventing instruments that unlock new music,Health care
"In our baby's illness, a life lesson",Health care
How to get (a new) hip,Health care
How low-cost eye care can be world-class,Health care
How electroshock therapy changed me,Health care
How do we heal medicine?,Health care
How brains learn to see,Health care
Health care should be a team sport,Health care
Healing through diet,Health care
Four ways to fix a broken legal system,Health care
Experiments that point to a new understanding of cancer,Health care
Ethical riddles in HIV research,Health care
"Design for people, not awards",Health care
Crowdsource your health,Health care
Could tissue engineering mean personalized medicine?,Health care
Battling bad science,Health care
Are we over-medicalized?,Health care
An unexpected place of healing,Health care
Aid versus trade,Health care
Adjustable liquid-filled eyeglasses,Health care
A universal translator for surgeons,Health care
A tale of mental illness -- from the inside,Health care
A roadmap to end aging,Health care
A next-gen cure for killer infections,Health care
A new strategy in the war on cancer,Health care
A hospital tour in Nigeria,Health care
A doctor's touch,Health care
A broken body isn't a broken person,Health care
A better way to harvest bone marrow,Health care
Your health depends on where you live,Heart health
World-class health care,Heart health
The single biggest health threat women face,Heart health
"Surgery's past, present and robotic future",Heart health
Own your body's data,Heart health
How I repaired my own heart,Heart health
How do we heal medicine?,Heart health
His and hers ¡¦ healthcare,Heart health
Health care should be a team sport,Heart health
Could the sun be good for your heart?,Heart health
Why we should trust scientists,History
Why is 'x' the unknown?,History
Why I love a country that once betrayed me,History
Why do societies collapse?,History
When people of Muslim heritage challenge fundamentalism,History
Unintended consequences,History
Toward a science of simplicity,History
This isn't her mother's feminism,History
The world's largest family reunion ¡¦ we're all invited!,History
"The web is more than ""better TV""",History
The visual magic of comics,History
The unheard story of David and Goliath,History
The story of Project Orion,History
The search for the true face of Leonardo,History
The Philosophical Breakfast Club,History
The mathematics of history,History
The hunt for General Tso,History
The history of our world in 18 minutes,History
The greatest machine that never was,History
The electricity metaphor for the web's future,History
The day I turned down Tim Berners-Lee,History
The dark secrets of a surveillance state,History
The birth of the computer,History
The art of the interview,History
The art of creating awe,History
The ancient ingenuity of water harvesting,History
The ancestor of language,History
The 4 stories we tell ourselves about death,History
Technology's epic story,History
Sputnik mania,History
Revealing the lost codex of Archimedes,History
"Pool medical patents, save lives",History
Play! Experiment! Discover!,History
Odes to vice and consequences,History
New York -- before the City,History
My friend Richard Feynman,History
My father the forger,History
Music and emotion through time,History
Mapping the future of countries,History
Lessons from the 1918 flu,History
Lessons from past presidents,History
Learn to use the 13th-century astrolabe,History
Hurdy-gurdy for beginners,History
How we discovered DNA,History
How to survive a nuclear attack,History
How to build an information time machine,History
"How the ""ghost map"" helped end a killer disease",History
How technology evolves,History
How our stories cross over,History
How ideas trump crises,History
"How I learned to stop worrying and love ""useless"" art",History
How architecture helped music evolve,History
Gaming for understanding,History
Four American characters,History
Finding the story inside the painting,History
Digging up dinosaurs,History
Designers -- think big!,History
"Depressed dogs, cats with OCD ? what animal madness means for us humans",History
Capturing memories in video art,History
Cape Breton fiddling in reel time,History
Archeology from space,History
Ancient wonders captured in 3D,History
America's native prisoners of war,History
A theory of Earth's mass extinctions,History
A Rosetta Stone for a lost language,History
A new way to explain explanation,History
A free digital library,History
3 reasons we still haven¡¯t gotten rid of malaria,History
2600 years of history in one object,History
10 things you didn't know about orgasm,History
"""Love Is a Loaded Pistol""",History
The search for humanity's roots,Human origins
Skin color is an illusion,Human origins
"How bacteria ""talk""",Human origins
A dig for humanity's origins,Human origins
Wake up!,Humanity
The world's largest family reunion ¡¦ we're all invited!,Humanity
The search for humanity's roots,Humanity
The psychology of your future self,Humanity
The new power of collaboration,Humanity
The history of our world in 18 minutes,Humanity
The 4 stories we tell ourselves about death,Humanity
Skin color is an illusion,Humanity
Robots will invade our lives,Humanity
Prepare for a good end of life,Humanity
Photographing the hidden story,Humanity
Our natural sleep cycle,Humanity
On humanity,Humanity
My year of living biblically,Humanity
My web playroom,Humanity
Medical miracle on Everest,Humanity
How to combat modern slavery,Humanity
How the Internet enables intimacy,Humanity
How social networks predict epidemics,Humanity
How low-cost eye care can be world-class,Humanity
Health and the human mind,Humanity
Design and destiny,Humanity
"Cute, sexy, sweet, funny",Humanity
Can we prevent the end of the world?,Humanity
Are you human?,Humanity
A wide-angle view of fragile Earth,Humanity
A realistic vision for world peace,Humanity
A one-woman global village,Humanity
A dig for humanity's origins,Humanity
10 ways the world could end,Humanity
Wry photos that turn stereotypes upside down,Humor
Why I fell in love with monster prime numbers,Humor
What's so funny about mental illness?,Humor
What you don't know about marriage,Humor
What is retro-futurism?,Humor
What does the future hold? 11 characters offer quirky answers,Humor
We're worried about local warming ... in your lap,Humor
We are all designers,Humor
Wake up!,Humor
Tidying up art,Humor
The world's largest family reunion ¡¦ we're all invited!,Humor
The pursuit of ignorance,Humor
The myth of the gay agenda,Humor
The mystery box,Humor
The music wars,Humor
The Museum of Four in the Morning,Humor
The Jill and Julia Show,Humor
The greatest TED Talk ever sold,Humor
The $8 billion iPod,Humor
Success is a continuous journey,Humor
"Please, please, people. Let's put the 'awe' back in 'awesome'",Humor
Playing invisible turntables,Humor
On humanity,Humor
My year of living biblically,Humor
My web playroom,Humor
Moving sculpture,Humor
Learning from Sherman the shark,Humor
Juggle and jest,Humor
"It's time for ""The Talk""",Humor
"I¡¯m not your inspiration, thank you very much",Humor
How to use a paper towel,Humor
How healthy living nearly killed me,Humor
"How art, technology and design inform creative leaders",Humor
How a dead duck changed my life,Humor
High-tech art (with a sense of humor),Humor
Health and the human mind,Humor
"Forget multitasking, try monotasking",Humor
Fashion and creativity,Humor
"Everyday moments, caught in time",Humor
Drawing on humor for change,Humor
Don't eat the marshmallow!,Humor
Do the green thing,Humor
Designing with slogans,Humor
"Designing books is no laughing matter. OK, it is.",Humor
"Design, explained.",Humor
Design and discovery,Humor
Design and destiny,Humor
"Cute, sexy, sweet, funny",Humor
"Comics that ask ""what if?""",Humor
Comics of bygone New York,Humor
Comedy is translation,Humor
Close-up card magic with a twist,Humor
Beats that defy boxes,Humor
Are you human?,Humor
"Archeology, animal photography, BBQ ...",Humor
Anatomy of a New Yorker cartoon,Humor
An illustrated journey through Rome,Humor
All things are Moleeds,Humor
"Aliens, love -- where are they?",Humor
A tour of modern architecture,Humor
A theory of everything,Humor
A story of mixed emoticons,Humor
A song of the city,Humor
"A Saudi, an Indian and an Iranian walk into a Qatari bar ...",Humor
A one-woman global village,Humor
10 things you didn't know about orgasm,Humor
"""Mother of Pearl,"" ""If I Had You""",Humor
Why I must come out,Identity
Who am I? Think again,Identity
This isn't her mother's feminism,Identity
The invisible man,Identity
The danger of a single story,Identity
How the worst moments in our lives make us who we are,Identity
How our stories cross over,Identity
How movies teach manhood,Identity
How I became an activist,Identity
Fifty shades of gay,Identity
A teen just trying to figure it out,Identity
A one-woman global village,Identity
A broken body isn't a broken person,Identity
The painter and the pendulum,Illness
Solving medical mysteries,Illness
My stroke of insight,Illness
"Mosquitos, malaria and education",Illness
Living beyond limits,Illness
How electroshock therapy changed me,Illness
Can we domesticate germs?,Illness
Body parts on a chip,Illness
Battling bad science,Illness
3 clues to understanding your brain,Illness
Why people believe weird things,Illusion
What we think we know,Illusion
Visual illusions that show how we (mis)think,Illusion
The magic of truth and lies (and iPods),Illusion
The magic of the placebo,Illusion
The illusion of consciousness,Illusion
Playing invisible turntables,Illusion
On glamour,Illusion
Close-up card magic with a twist,Illusion
Brain magic,Illusion
Battling bad science,Illusion
"Art with wire, sugar, chocolate and string",Illusion
A magical tale (with augmented reality),Illusion
A cyber-magic card trick like no other,Illusion
3 clues to understanding your brain,Illusion
We need to feed the whole world,Industrial design
Toys and materials from the future,Industrial design
To invent is to give,Industrial design
The real future of space exploration,Industrial design
"The emergence of ""4D printing""",Industrial design
Simple designs to save a life,Industrial design
"Organic design, inspired by nature",Industrial design
My life in typefaces,Industrial design
Great cars are great art,Industrial design
Design is in the details,Industrial design
Breakthrough designs for ultra-low-cost products,Industrial design
A 3D-printed jumbo jet?,Industrial design
Why I must come out,Inequality
Who controls the world?,Inequality
What the gay rights movement learned from the civil rights movement,Inequality
We need to talk about an injustice,Inequality
Use data to build better schools,Inequality
The rise of the new global super-rich,Inequality
The myth of the gay agenda,Inequality
"The good news on poverty (Yes, there's good news)",Inequality
The good news of the decade?,Inequality
The economic injustice of plastic,Inequality
New insights on poverty,Inequality
Navigating our global future,Inequality
Making global labor fair,Inequality
How economic inequality harms societies,Inequality
Greening the ghetto,Inequality
Fifty shades of gay,Inequality
Color blind or color brave?,Inequality
"Can we all ""have it all""?",Inequality
"Beware, fellow plutocrats, the pitchforks are coming",Inequality
4 pillars of college success in science,Inequality
You don't need an app for that,Innovation
Why we need the explorers,Innovation
Where good ideas come from,Innovation
We are makers,Innovation
"Want to innovate? Become a ""now-ist""",Innovation
To invent is to give,Innovation
The power of time off,Innovation
"The mind behind Tesla, SpaceX, SolarCity ...",Innovation
The link between unemployment and terrorism,Innovation
The levitating superconductor,Innovation
The era of open innovation,Innovation
The electricity metaphor for the web's future,Innovation
"The death of innovation, the end of growth",Innovation
The deadly genius of drug cartels,Innovation
The cheap all-terrain wheelchair,Innovation
The ancient ingenuity of water harvesting,Innovation
The $80 prosthetic knee that's changing lives,Innovation
Science-inspired design,Innovation
Pop an ollie and innovate!,Innovation
"Playing ""Pink Noise"" on guitar",Innovation
My radical plan for small nuclear fission reactors,Innovation
My library of human imagination,Innovation
Life lessons through tinkering,Innovation
Learn to use the 13th-century astrolabe,Innovation
Intricate beauty by design,Innovation
India's invisible innovation,Innovation
India's hidden hotbeds of invention,Innovation
Imaging at a trillion frames per second,Innovation
I listen to color,Innovation
How web video powers global innovation,Innovation
How to air-condition outdoor spaces,Innovation
"How to ""sketch"" with electronics",Innovation
How the market can keep streams flowing,Innovation
How I started a sanitary napkin revolution!,Innovation
How I repaired my own heart,Innovation
"Government -- investor, risk-taker, innovator",Innovation
From mach-20 glider to hummingbird drone,Innovation
Everyday inventions,Innovation
Education innovation in the slums,Innovation
Could this laser zap malaria?,Innovation
Biomimicry in action,Innovation
"Are athletes really getting faster, better, stronger?",Innovation
An independent diplomat,Innovation
Adjustable liquid-filled eyeglasses,Innovation
A warm embrace that saves lives,Innovation
A third way to think about aid,Innovation
A test for Parkinson's with a phone call,Innovation
A full-band beatbox,Innovation
A bath without water,Innovation
A 30-year history of the future,Innovation
Your brain is more than a bag of chemicals,Insects
Why not eat insects?,Insects
Why bees are disappearing,Insects
"What ants teach us about the brain, cancer and the Internet",Insects
The loves and lies of fireflies,Insects
The hidden beauty of pollination,Insects
The emergent genius of ant colonies,Insects
The dance of the dung beetle,Insects
The beautiful tricks of flowers,Insects
"Science is for everyone, kids included",Insects
Re-engineering mosquitos to fight disease,Insects
Natural pest control ... using bugs!,Insects
My wish: Build the Encyclopedia of Life,Insects
"Mosquitos, malaria and education",Insects
How a fly flies,Insects
Hidden miracles of the natural world,Insects
Every city needs healthy honey bees,Insects
Dragonflies that fly across oceans,Insects
Could this laser zap malaria?,Insects
Conserving the canopy,Insects
"Cheese, dogs and a pill to kill mosquitoes and end malaria",Insects
A plea for bees,Insects
3 reasons we still haven¡¯t gotten rid of malaria,Insects
Where¡¯s Google going next?,Intelligence
What adults can learn from kids,Intelligence
The rise of human-computer cooperation,Intelligence
The gentle genius of bonobos,Intelligence
The dark secrets of a surveillance state,Intelligence
Robots will invade our lives,Intelligence
Join the SETI search,Intelligence
How brain science will change computing,Intelligence
A thought experiment on the intelligence of crows,Intelligence
A new equation for intelligence,Intelligence
A 30-year history of the future,Intelligence
Why Google Glass?,Interface design
The shape-shifting future of the mobile phone,Interface design
The radical promise of the multi-touch interface,Interface design
The best computer interface? Maybe ... your hands,Interface design
Simplicity sells,Interface design
Rethink the desktop with BumpTop,Interface design
Reach into the computer and grab a pixel,Interface design
Pointing to the future of UI,Interface design
"Online video -- annotated, remixed and popped",Interface design
On the virtual dissection table,Interface design
Meet the SixthSense interaction,Interface design
Making sense of maps,Interface design
Is Pivot a turning point for web exploration?,Interface design
Image recognition that triggers augmented reality,Interface design
Art that craves your attention,Interface design
A thought experiment on the intelligence of crows,Interface design
A headset that reads your brainwaves,Interface design
A 30-year history of the future,Interface design
"5 predictions, from 1984",Interface design
Wireless data from every light bulb,Internet
Why massive open online courses (still) matter,Internet
What we're learning from online education,Internet
Tracking our online trackers,Internet
Three types of online attack,Internet
The year open data went worldwide,Internet
The Web as random acts of kindness,Internet
The interspecies internet? An idea in progress,Internet
The Internet could crash. We need a Plan B,Internet
The history of our world in 18 minutes,Internet
The case for anonymity online,Internet
"The 100,000-student classroom",Internet
Revealing the lost codex of Archimedes,Internet
Reinventing the encyclopedia game,Internet
Re-examining the remix,Internet
"Online video -- annotated, remixed and popped",Internet
My web playroom,Internet
Massive-scale online collaboration,Internet
Let's teach kids to code,Internet
How to separate fact and fiction online,Internet
How to make a splash in social media,Internet
How the NSA betrayed the world's trust -- time to act,Internet
How the Net aids dictatorships,Internet
How the Internet will (one day) transform government,Internet
"How art, technology and design inform creative leaders",Internet
Hire the hackers!,Internet
Here's how we take back the Internet,Internet
Hackers: the Internet's immune system,Internet
Government surveillance ? this is just the beginning,Internet
"Fighting viruses, defending the net",Internet
Discover the physical side of the internet,Internet
All your devices can be hacked,Internet
A vision of crimes in the future,Internet
A Magna Carta for the web,Internet
"Life at 30,000 feet",Interview
How I built a windmill,Interview
Global ethic vs. national interest,Interview
Four American characters,Interview
A memorial at Ground Zero,Interview
"A master architect asks, Now what?",Interview
Wireless data from every light bulb,Invention
Unleash your creativity in a Fab Lab,Invention
Unintended consequences,Invention
Toys and materials from the future,Invention
Toy tiles that talk to each other,Invention
To invent is to give,Invention
The world needs all kinds of minds,Invention
The strange tale of the Norden bombsight,Invention
The route to a sustainable future,Invention
The real future of space exploration,Invention
The next web,Invention
The missing link to renewable energy,Invention
The life code that will reshape the future,Invention
The joyful tradition of mountain music,Invention
The invention that unlocked a locked-in artist,Invention
The era of open innovation,Invention
The electricity metaphor for the web's future,Invention
The cheap all-terrain wheelchair,Invention
The birth of Wikipedia,Invention
The art of bow-making,Invention
The accelerating power of technology,Invention
Software (as) art,Invention
Simple designs to save a life,Invention
"Silk, the ancient material of the future",Invention
Sampling the ocean's DNA,Invention
Printing a human kidney,Invention
"Pool medical patents, save lives",Invention
Pointing to the future of UI,Invention
"Playtime with Pleo, your robotic dinosaur friend",Invention
"Organic design, inspired by nature",Invention
One very dry demo,Invention
On the verge of creating synthetic life,Invention
My wish: Three unusual medical inventions,Invention
My wish: A call for open-source architecture,Invention
My mushroom burial suit,Invention
My library of human imagination,Invention
My dream of a flying car,Invention
Metal that breathes,Invention
"Luke, a new prosthetic arm for soldiers",Invention
Life lessons through tinkering,Invention
Learning from a barefoot movement,Invention
Innovating to zero!,Invention
India's hidden hotbeds of invention,Invention
Imaging at a trillion frames per second,Invention
Hypersonic sound and other inventions,Invention
How we discovered DNA,Invention
How to pitch to a VC,Invention
How to make filthy water drinkable,Invention
How to air-condition outdoor spaces,Invention
"How to ""sketch"" with electronics",Invention
How mobile phones can fight poverty,Invention
How I started a sanitary napkin revolution!,Invention
How I harnessed the wind,Invention
How architecture can connect us,Invention
"Hack a banana, make a keyboard!",Invention
Great cars are great art,Invention
Get your next eye exam on a smartphone,Invention
Extreme wingsuit flying,Invention
Everyday inventions,Invention
Eco-friendly drywall,Invention
Demo: The Orb,Invention
Could this laser zap malaria?,Invention
Bring on the learning revolution!,Invention
Biomimicry in action,Invention
Bio-lab on a microchip,Invention
Ancient wonders captured in 3D,Invention
Adjustable liquid-filled eyeglasses,Invention
Abundance is our future,Invention
A warm embrace that saves lives,Invention
A tool to fix one of the most dangerous moments in surgery,Invention
A third way to think about aid,Invention
A solar energy system that tracks the sun,Invention
"A prosthetic arm that ""feels""",Invention
A plane you can drive,Invention
A mobile fridge for vaccines,Invention
"A master architect asks, Now what?",Invention
A hospital tour in Nigeria,Invention
A flight through the ocean,Invention
A flight on solar wings,Invention
A bath without water,Invention
"A ""self-healing"" asphalt",Invention
Why we should invest in a free press,Investment
Why invest in Africa,Investment
"Want to innovate? Become a ""now-ist""",Investment
Want to help Africa? Do business here,Investment
The investment logic for sustainability,Investment
Salvation (and profit) in greentech,Investment
Patient capitalism,Investment
Invest in Africa's own solutions,Investment
Inspiring a life of immersion,Investment
How to rebuild a broken state,Investment
How to pitch to a VC,Investment
How mobile phones can fight poverty,Investment
"Government -- investor, risk-taker, innovator",Investment
Aid versus trade,Investment
Aid for Africa? No thanks.,Investment
Israel and Iran: A love story?,Iran
Iran and Israel: Peace is possible,Iran
Did you hear the one about the Iranian-American?,Iran
"Cracking Stuxnet, a 21st-century cyber weapon",Iran
"Women, wartime and the dream of peace",Iraq
Why the world needs WikiLeaks,Iraq
The path to ending ethnic conflicts,Iraq
The military case for sharing knowledge,Iraq
On being a woman and a diplomat,Iraq
"Listen, learn ... then lead",Iraq
An independent diplomat,Iraq
A radical experiment in empathy,Iraq
A historic moment in the Arab world,Iraq
The doubt essential to faith,Islam
Superheroes inspired by Islam,Islam
"Globalizing the local, localizing the global",Islam
Faith versus tradition in Islam,Islam
A Saudi woman who dared to drive,Islam
There are no mistakes on the bandstand,Jazz
"Robots with ""soul""",Jazz
Women should represent women in media,Journalism
What it takes to do extreme astrophysics,Journalism
What I saw in the war,Journalism
We are all designers,Journalism
The shocking move to criminalize nonviolent protest,Journalism
The hidden light of Afghanistan,Journalism
The courage to tell a hidden story,Journalism
See Yemen through my eyes,Journalism
On reading the Koran,Journalism
My battle to expose government corruption,Journalism
Let¡¯s try emotional correctness,Journalism
How to separate fact and fiction online,Journalism
"How I named, shamed and jailed",Journalism
Here's how we take back the Internet,Journalism
"Does the media have a ""duty of care""?",Journalism
"Beware online ""filter bubbles""",Journalism
Behind the Great Firewall of China,Journalism
Are we born to run?,Journalism
A glimpse of life on the road,Journalism
Why people need poetry,Language
Why is 'x' the unknown?,Language
What's a snollygoster? A short lesson in political speak,Language
What our language habits reveal,Language
"What makes a word ""real""?",Language
Txtng is killing language. JK!!!,Language
The world's English mania,Language
The mathematics of history,Language
The linguistic genius of babies,Language
The joy of lexicography,Language
The gentle genius of bonobos,Language
The birth of a word,Language
The ancestor of language,Language
"Smash fear, learn anything",Language
"Please, please, people. Let's put the 'awe' back in 'awesome'",Language
Metaphorically speaking,Language
Massive-scale online collaboration,Language
Listening to global voices,Language
Let's simplify legal jargon!,Language
Learn to read Chinese ... with ease!,Language
Ingenuity and elegance in ancient African alphabets,Language
Human nature and the blank slate,Language
How language transformed humanity,Language
For argument¡¯s sake,Language
Dreams from endangered cultures,Language
Don't kill your language,Language
Don't insist on English!,Language
Could your language affect your ability to save money?,Language
Could we speak the language of dolphins?,Language
Comedy is translation,Language
A word game to communicate in any language,Language
A Rosetta Stone for a lost language,Language
3 ways to speak English,Language
Why buses represent democracy in action,Latin America
The fight to end rare-animal trafficking in Brazil,Latin America
The El Sistema music revolution,Latin America
The 4 commandments of cities,Latin America
Tales of passion,Latin America
How architectural innovations migrate across borders,Latin America
A song of the city,Latin America
Why eyewitnesses get it wrong,Law
"We the People, and the Republic we must reclaim",Law
We need to talk about an injustice,Law
The Web as random acts of kindness,Law
The power of the informal economy,Law
