title,Root_topic
"Playtime with Pleo, your robotic dinosaur friend",Play
Play is more than just fun,Play
My web playroom,Play
"How to ""sketch"" with electronics",Play
Gaming can make a better world,Play
"Evolution's gift of play, from bonobo apes to humans",Play
"A manifesto for play, for Bulgaria and beyond",Play
5 dangerous things you should let your kids do,Play
Your elusive creative genius,Poetry
Wiring an interactive ocean,Poetry
Why people need poetry,Poetry
Two poems about what dogs think (probably),Poetry
To This Day ... for the bullied and beautiful,Poetry
The surprising spread of Idol TV,Poetry
The music of a war child,Poetry
The difference between winning and succeeding,Poetry
The danger of silence,Poetry
The business logic of sustainability,Poetry
The brain in love,Poetry
The  4 a.m. mystery,Poetry
Telling stories from Africa,Poetry
"Suddenly, my body",Poetry
Singing old poems to life,Poetry
"Singing ""What I Want""",Poetry
Poetry of youth and age,Poetry
"Poems of war, peace, women, power",Poetry
Please don't take my Air Jordans,Poetry
On humanity,Poetry
Odes to vice and consequences,Poetry
Metaphorically speaking,Poetry
If I should have a daughter ...,Poetry
If I controlled the Internet,Poetry
"Everyday moments, caught in time",Poetry
Don't kill your language,Poetry
Beats that defy boxes,Poetry
Art that looks back at you,Poetry
A story of mixed emoticons,Poetry
A mockingbird remix of TED2006,Poetry
¡°High School Training Ground¡±,Poetry
"""Women of Hope""",Poetry
"""Black Men Ski""",Poetry
Why privacy matters,Policy
Why ordinary people need to understand power,Policy
Which country does the most good for the world?,Policy
"Can we all ""have it all""?",Policy
"Women, wartime and the dream of peace",Politics
Wiring a web for global good,Politics
Why we shouldn't trust markets with our civic life,Politics
Why we do what we do,Politics
Why the world needs WikiLeaks,Politics
Why the world needs charter cities,Politics
Why SOPA is a bad idea,Politics
Why ordinary people need to understand power,Politics
Why nations should pursue soft power,Politics
Why mayors should rule the world,Politics
Why Libya's revolution didn't work -- and what might,Politics
Why I love a country that once betrayed me,Politics
Why global jihad is losing,Politics
Why democracy matters,Politics
When people of Muslim heritage challenge fundamentalism,Politics
What's a snollygoster? A short lesson in political speak,Politics
What we learned from teetering on the fiscal cliff,Politics
What we don't understand about trust,Politics
"We the People, and the Republic we must reclaim",Politics
Time to end the war in Afghanistan,Politics
Three types of online attack,Politics
The world's first charter city?,Politics
The Web as a city,Politics
"The walk from ""no"" to ""yes""",Politics
The unstoppable walk to political reform,Politics
The surprising spread of Idol TV,Politics
The strange politics of disgust,Politics
The shocking move to criminalize nonviolent protest,Politics
The power of cartoons,Politics
The politics of fiction,Politics
The playful search for beauty,Politics
The path to ending ethnic conflicts,Politics
The next age of government,Politics
The myth of the gay agenda,Politics
The music of a war child,Politics
"The mothers who found forgiveness, friendship",Politics
The moral roots of liberals and conservatives,Politics
The lost art of democratic debate,Politics
The invisible man,Politics
The hidden world of shadow cities,Politics
The global power shift,Politics
The generation that's remaking China,Politics
The family I lost in North Korea. And the family I gained.,Politics
The Axis of Evil Middle East Comedy Tour,Politics
The antidote to apathy,Politics
"The ""bottom billion""",Politics
Telling stories from Africa,Politics
Teaching with the World Peace Game,Politics
Taking OLPC to Colombia,Politics
Take back your city with paint,Politics
"Take ""the Other"" to lunch",Politics
Sweat the small stuff,Politics
Sputnik mania,Politics
See Yemen through my eyes,Politics
Science and democracy,Politics
Saving the ocean one island at a time,Politics
Politics and religion are technologies,Politics
Political change with pen and paper,Politics
Our loss of wisdom,Politics
On humanity,Politics
On glamour,Politics
New thinking on the climate crisis,Politics
New rules for rebuilding a broken nation,Politics
My wish: Three actions for Africa,Politics
My wish: The Charter for Compassion,Politics
My message of peace from Pakistan,Politics
My escape from North Korea,Politics
My battle to expose government corruption,Politics
Mother and daughter doctor-heroes,Politics
Military robots and the future of war,Politics
Militant atheism,Politics
Mapping the future of countries,Politics
Making law on the high seas,Politics
Let's take back the Internet!,Politics
Let's revive the Golden Rule,Politics
Let¡¯s try emotional correctness,Politics
Lessons from the 1918 flu,Politics
Lessons from past presidents,Politics
Lessons from death row inmates,Politics
Learning from leadership's missing manual,Politics
Is China the new idol for emerging economies?,Politics
Is anatomy destiny?,Politics
Iran and Israel: Peace is possible,Politics
Inside the Egyptian revolution,Politics
Inside a school for suicide bombers,Politics
In defense of dialogue,Politics
Imagine a European democracy without borders,Politics
Ideas for India's future,Politics
How to topple a dictator,Politics
How to stop torture,Politics
How to expose the corrupt,Politics
How to educate leaders? Liberal arts,Politics
How the Net aids dictatorships,Politics
How the Internet will (one day) transform government,Politics
How state budgets are breaking US schools,Politics
How social media can make history,Politics
How I became an activist,Politics
How cyberattacks threaten real-world peace,Politics
How common threats can make common (political) ground,Politics
Health and the human mind,Politics
Greening the ghetto,Politics
Global power shifts,Politics
Global ethic vs. national interest,Politics
Filming democracy in Ghana,Politics
E-voting without fraud,Politics
Ending hunger now,Politics
Don't kill your language,Politics
"Does the media have a ""duty of care""?",Politics
Does racism affect how you vote?,Politics
Does democracy stifle economic growth?,Politics
Did you hear the one about the Iranian-American?,Politics
Demand a more open-source government,Politics
Debate: Does the world need nuclear energy?,Politics
Dance to change the world,Politics
"Cracking Stuxnet, a 21st-century cyber weapon",Politics
Can democracy exist without trust?,Politics
Bringing peace to the minds of Afghanistan,Politics
"Beware online ""filter bubbles""",Politics
Be passionate. Be courageous. Be your best.,Politics
Averting the climate crisis,Politics
Art in exile,Politics
An independent diplomat,Politics
Aid for Africa? No thanks.,Politics
Africa's cheetahs versus hippos,Politics
A tale of two political systems,Politics
A radical experiment in empathy,Politics
A prediction for the future of Iran,Politics
A police chief with a difference,Politics
A plea for education,Politics
A parable for Kenya,Politics
A one-man world summit,Politics
A Navy Admiral's thoughts on global security,Politics
A historic moment in the Arab world,Politics
A global culture to fight extremism,Politics
A feminine response to Iceland's financial crash,Politics
A complicated hero in the war on dictatorship,Politics
A call to reinvent liberal arts education,Politics
A 40-year plan for energy,Politics
Two young scientists break down plastics with bacteria,Pollution
Transition to a world without oil,Pollution
"The oil spill's unseen culprits, victims",Pollution
My wish: Manufactured landscapes and green education,Pollution
How humans and animals can live together,Pollution
Greening the ghetto,Pollution
Award-winning teenage science in action,Pollution
6 ways mushrooms can save the world,Pollution
Religions and babies,Population
How Mr. Condom made Thailand a better place,Population
You are the future of philanthropy,Potential
Why we do what we do,Potential
Why did I ski to the North Pole?,Potential
Why bother leaving the house?,Potential
The paradox of choice,Potential
In praise of slowness,Potential
Ideas for India's future,Potential
A new way to fight corruption,Potential
"""What You've Got""",Potential
"Women entrepreneurs, example not exception",Poverty
What squatter cities can teach us,Poverty
What if our healthcare system kept us healthy?,Poverty
We need money for aid. So let¡¯s print it.,Poverty
There are no scraps of men,Poverty
The year I was homeless,Poverty
The universal anesthesia machine,Poverty
"The good news on poverty (Yes, there's good news)",Poverty
The fight against sex slavery,Poverty
The El Sistema music revolution,Poverty
The economic injustice of plastic,Poverty
The cheap all-terrain wheelchair,Poverty
"The ""bottom billion""",Poverty
Teaching one child at a time,Poverty
Teaching design for change,Poverty
Social experiments to fight poverty,Poverty
"Poverty, money -- and love",Poverty
Photos that changed the world,Poverty
Patient capitalism,Poverty
Our century's greatest injustice,Poverty
New rules for rebuilding a broken nation,Poverty
My wish: Three actions for Africa,Poverty
My wish: Let my photographs bear witness,Poverty
Let's crowdsource the world's goals,Poverty
Invest in Africa's own solutions,Poverty
India's hidden hotbeds of invention,Poverty
How mobile phones can fight poverty,Poverty
How I harnessed the wind,Poverty
"Global population growth, box by box",Poverty
Could this laser zap malaria?,Poverty
Bringing peace to the minds of Afghanistan,Poverty
An escape from poverty,Poverty
An economic reality check,Poverty
America's native prisoners of war,Poverty
A third way to think about aid,Poverty
A new way to fight corruption,Poverty
A lab the size of a postage stamp,Poverty
How we can predict the next financial crisis,Prediction
"Global population growth, box by box",Prediction
A university for the coming singularity,Prediction
A prediction for the future of Iran,Prediction
A 30-year history of the future,Prediction
What comes after An Inconvenient Truth?,Presentation
Religions and babies,Presentation
Making sound visible through cymatics,Presentation
Let my dataset change your mindset,Presentation
How to pitch to a VC,Presentation
HIV -- new facts and stunning data visuals,Presentation
"Global population growth, box by box",Presentation
"Doodlers, unite!",Presentation
"Dance vs. powerpoint, a modest proposal",Presentation
3 ways the brain creates meaning,Presentation
What separates us from chimpanzees?,Primates
How humans and animals can live together,Primates
"Cute, sexy, sweet, funny",Primates
Why your worst deeds don¡¯t define you,Prison
Why eyewitnesses get it wrong,Prison
The psychology of evil,Prison
Strange answers to the psychopath test,Prison
Philosophy in prison,Prison
Life science in prison,Prison
Lessons in business ... from prison,Prison
Lessons from death row inmates,Prison
How to stop torture,Prison
How prisons can help inmates live meaningful lives,Prison
Why privacy matters,Privacy
What¡¯s wrong with your pa$$w0rd?,Privacy
"The hunt for ""unexpected genetic heroes""",Privacy
The era of open innovation,Product design
Science-inspired design,Product design
"Organic design, inspired by nature",Product design
How pig parts make the world turn,Product design
"Forget multitasking, try monotasking",Product design
Everyday inventions,Product design
Designers -- think big!,Product design
Design is in the details,Product design
"Design for people, not awards",Product design
Are mushrooms the new plastic?,Product design
Adjustable liquid-filled eyeglasses,Product design
A tool to fix one of the most dangerous moments in surgery,Product design
What makes us feel good about our work?,Productivity
Success is a continuous journey,Productivity
"Smash fear, learn anything",Productivity
Smart failure for a fast-changing world,Productivity
How to succeed? Get more sleep,Productivity
"As work gets more complex, 6 rules to simplify",Productivity
All it takes is 10 mindful minutes,Productivity
There are no scraps of men,Prosthetics
The sore problem of prosthetic limbs,Prosthetics
The opportunity of adversity,Prosthetics
"The new bionics that let us run, climb and dance",Prosthetics
The emotion behind invention,Prosthetics
Printing a human kidney,Prosthetics
My 12 pairs of legs,Prosthetics
"Luke, a new prosthetic arm for soldiers",Prosthetics
Living beyond limits,Prosthetics
I listen to color,Prosthetics
Changing my legs - and my mindset,Prosthetics
"A prosthetic arm that ""feels""",Prosthetics
Three myths about corruption,Protests
The attitudes that sparked Arab Spring,Protests
Let's take back the Internet!,Protests
Inside the Egyptian revolution,Protests
How to topple a dictator,Protests
Can democracy exist without trust?,Protests
A thousand times no,Protests
A historic moment in the Arab world,Protests
Your body language shapes who you are,Psychology
Why we make bad decisions,Psychology
"Why we love, why we cheat",Psychology
Why we do what we do,Psychology
Why the universe seems so strange,Psychology
Why aren't we more compassionate?,Psychology
What our language habits reveal,Psychology
What hallucination reveals about our minds,Psychology
What do babies think?,Psychology
Want to be happier? Stay in the moment,Psychology
Visual illusions that show how we (mis)think,Psychology
The tragedy of orphanages,Psychology
The surprising science of happiness,Psychology
The strange politics of disgust,Psychology
The riddle of experience vs. memory,Psychology
The quantified self,Psychology
The psychology of your future self,Psychology
The psychology of time,Psychology
The psychology of evil,Psychology
The power of vulnerability,Psychology
The power of introverts,Psychology
The pattern behind self-deception,Psychology
The paradox of choice,Psychology
The origins of pleasure,Psychology
The optimism bias,Psychology
The new era of positive psychology,Psychology
The moral roots of liberals and conservatives,Psychology
The key to success? Grit,Psychology
The happy secret to better work,Psychology
The game layer on top of the world,Psychology
The fiction of memory,Psychology
The brain in love,Psychology
The art of choosing,Psychology
The 3 A's of awesome,Psychology
Success is a continuous journey,Psychology
Should you live for your r?sum? ... or your eulogy?,Psychology
Shh! Sound health in 8 steps,Psychology
Science can answer moral questions,Psychology
"Saving for tomorrow, tomorrow",Psychology
Play is more than just fun,Psychology
Our buggy moral code,Psychology
Optical illusions show how we see,Psychology
"Meet Milo, the virtual boy",Psychology
Measuring what makes life worthwhile,Psychology
Listening to shame,Psychology
Life lessons from an ad man,Psychology
Lead like the great conductors,Psychology
"Know thyself, with a brain scanner",Psychology
In praise of slowness,Psychology
Human nature and the blank slate,Psychology
How to spot a liar,Psychology
How to make stress your friend,Psychology
How to buy happiness,Psychology
How the Internet enables intimacy,Psychology
How behavioral science can lower your energy bill,Psychology
Happiness and its surprises,Psychology
Gaming to re-engage boys in learning,Psychology
"Flow, the secret to happiness",Psychology
Exploring the mind of a killer,Psychology
"Embracing otherness, embracing myself",Psychology
Don't eat the marshmallow!,Psychology
Dog-friendly dog training,Psychology
Does money make you mean?,Psychology
"Depressed dogs, cats with OCD ? what animal madness means for us humans",Psychology
Can prejudice ever be a good thing?,Psychology
"Build a tower, build a team",Psychology
Bringing peace to the minds of Afghanistan,Psychology
Are we in control of our own decisions?,Psychology
A new way to diagnose autism,Psychology
A monkey economy as irrational as ours,Psychology
8 secrets of success,Psychology
Your health depends on where you live,Public health
World-class health care,Public health
What if our healthcare system kept us healthy?,Public health
What doctors can learn from each other,Public health
We need better drugs -- now,Public health
The coming neurological epidemic,Public health
Mental health for all by involving all,Public health
Is the obesity crisis hiding a bigger problem?,Public health
How to reduce poverty? Fix homes,Public health
How low-cost eye care can be world-class,Public health
How I started a sanitary napkin revolution!,Public health
Get your next eye exam on a smartphone,Public health
Doctors make mistakes. Can we talk about that?,Public health
Crowdsource your health,Public health
A hospital tour in Nigeria,Public health
What the gay rights movement learned from the civil rights movement,Race
The life-long learner,Race
The freakonomics of crack dealing,Race
Skin color is an illusion,Race
How art gives shape to cultural change,Race
Four American characters,Race
Does racism affect how you vote?,Race
Color blind or color brave?,Race
A family tree for humanity,Race
3 ways to speak English,Race
"""Black Men Ski""",Race
"Why we love, why we cheat",Relationships
Why giving away our wealth has been the most satisfying thing we've done,Relationships
Why domestic violence victims don't leave,Relationships
What you don't know about marriage,Relationships
The secret to desire in a long-term relationship,Relationships
The myth of the gay agenda,Relationships
The lost art of letter-writing,Relationships
The brain in love,Relationships
Remember to say thank you,Relationships
"It's time for ""The Talk""",Relationships
Fifty shades of gay,Relationships
Are we designed to be sexual omnivores?,Relationships
An ode to envy,Relationships
A little-told tale of sex and sensuality,Relationships
Why would God create a tsunami?,Religion
Why people believe weird things,Religion
Why global jihad is losing,Religion
When people of Muslim heritage challenge fundamentalism,Religion
We can be Buddhas,Religion
The worldwide web of belief and ritual,Religion
The technology of the heart,Religion
The profound journey of compassion,Religion
The habits of happiness,Religion
The doubt essential to faith,Religion
The danger of science denial,Religion
The balancing act of compassion,Religion
Science can answer moral questions,Religion
Religions and babies,Religion
"Religion, evolution, and the ecstasy of self-transcendence",Religion
Reconnecting with compassion,Religion
Politics and religion are technologies,Religion
On technology and faith,Religion
On reading the Koran,Religion
My year of living biblically,Religion
My wish: The Charter for Compassion,Religion
Militant atheism,Religion
"Lose your ego, find your compassion",Religion
Letting go of God,Religion
Let's teach religion -- all religion -- in schools,Religion
Let's revive the Golden Rule,Religion
Is religion good or bad? (This is a trick question),Religion
How cults rewire the brain,Religion
Faith versus tradition in Islam,Religion
Expanding your circle of compassion,Religion
Dangerous memes,Religion
Compassion at the dinner table,Religion
Atheism 2.0,Religion
A new way to explain explanation,Religion
A life of purpose,Religion
Why we will rely on robots,Robots
What will future jobs look like?,Robots
What happens inside those massive warehouses?,Robots
"Watson, Jeopardy and me, the obsolete know-it-all",Robots
To invent is to give,Robots
The story behind the Mars Rovers,Robots
The sticky wonder of gecko feet,Robots
"The secrets of nature's grossest creatures, channeled into robots",Robots
The rise of personal robots,Robots
The next species of human,Robots
The kill decision shouldn't belong to a robot,Robots
The astounding athletic power of quadcopters,Robots
The accelerating power of technology,Robots
Silicon-based comedy,Robots
"Robots with ""soul""",Robots
Robots will invade our lives,Robots
Robots that fly ... and cooperate,Robots
"Robots that ""show emotion""",Robots
Robots inspired by cockroach ingenuity,Robots
My underwater robot,Robots
My seven species of robot,Robots
Military robots and the future of war,Robots
"Meet Rezero, the dancing ballbot",Robots
Learning from the gecko's tail,Robots
How Arduino is open-sourcing imagination,Robots
Google's driverless car,Robots
"Dance, tiny robots!",Robots
"Building ""self-aware"" robots",Robots
"And for my next trick, a robot",Robots
A robot that flies like a bird,Robots
A mini robot -- powered by your phone,Robots
4 lessons from robots about being human,Robots
The story of Project Orion,Rocket science
The real future of space exploration,Rocket science
Model rocketry,Rocket science
"Yup, I built a nuclear fusion reactor",Science
Your genes are not your fate,Science
Your brain on improv,Science
World-class health care,Science
Wiring an interactive ocean,Science
Winning the oil endgame,Science
Will our kids be a different species?,Science
Why we're storing billions of seeds,Science
Why we should trust scientists,Science
Why we need to go back to Mars,Science
Why we need the explorers,Science
"Why we love, why we cheat",Science
Why truly innovative science demands a leap into the unknown,Science
Why the universe seems so strange,Science
Why people believe weird things,Science
Why our universe might exist on a knife-edge,Science
Why I must speak out about climate change,Science
Why I love vultures,Science
Why eyewitnesses get it wrong,Science
Why do we sleep?,Science
Why bees are disappearing,Science
Where good ideas come from,Science
Where are the baby dinosaurs?,Science
What's left to explore?,Science
"What we're learning from 5,000 brains",Science
What went wrong at the LHC,Science
What we think we know,Science
What we learn before we're born,Science
What we didn't know about penis anatomy,Science
"What we can learn from galaxies far, far away",Science
What separates us from chimpanzees?,Science
What our language habits reveal,Science
What it takes to do extreme astrophysics,Science
"What I'm worried about, what I'm excited about",Science
What humans can learn from semi-intelligent slime,Science
What doctors don't know about the drugs they prescribe,Science
What comes after An Inconvenient Truth?,Science
"What ants teach us about the brain, cancer and the Internet",Science
We're covered in germs. Let's design for that.,Science
Welcome to the genomic revolution,Science
We need better drugs -- now,Science
"Watch me unveil ""synthetic life""",Science
"Want to innovate? Become a ""now-ist""",Science
Visualizing the wonder of a living cell,Science
Visualizing the medical data explosion,Science
Using biology to rethink the energy challenge,Science
"Unseen footage, untamed nature",Science
Unleash your creativity in a Fab Lab,Science
Underwater astonishments,Science
Ultrasound surgery -- healing without cuts,Science
Two young scientists break down plastics with bacteria,Science
Turning trash into toys for learning,Science
"Trust, morality -- and oxytocin?",Science
Tracking ancient diseases using ... plaque,Science
Toys and materials from the future,Science
Tour the solar system from home,Science
To upgrade is human,Science
To invent is to give,Science
Time-lapse proof of extreme ice loss,Science
This is Saturn,Science
There might just be life on Mars,Science
The world needs all kinds of minds,Science
"The weird, wonderful world of bioluminescence",Science
The toxic baby,Science
The surprising science of happiness,Science
The surprising math of cities and corporations,Science
The strange politics of disgust,Science
The story of Project Orion,Science
The story behind the Mars Rovers,Science
The sticky wonder of gecko feet,Science
The sound the universe makes,Science
The single biggest health threat women face,Science
The shrimp with a kick!,Science
"The secrets of nature's grossest creatures, channeled into robots",Science
The secret of the bat genome,Science
The secret lives of paintings,Science
The search for humanity's roots,Science
The science of sync,Science
The science of scent,Science
The science behind a climate headline,Science
The roots of plant intelligence,Science
The riddle of experience vs. memory,Science
The real reason for brains,Science
The quest to understand consciousness,Science
The puzzle of motivation,Science
The pursuit of ignorance,Science
The psychology of time,Science
The promise of research with stem cells,Science
The Philosophical Breakfast Club,Science
The pattern behind self-deception,Science
The paralyzed rat that walked,Science
The painter and the pendulum,Science
The origins of pleasure,Science
The optimism bias,Science
The ocean's shifting baseline,Science
The ocean's glory -- and horror,Science
The next species of human,Science
The new era of positive psychology,Science
The neuroscience of restorative justice,Science
The neurons that shaped civilization,Science
The mystery of chronic pain,Science
The mysterious workings of the adolescent brain,Science
The mysterious lives of giant trees,Science
The mathematics of history,Science
The magnificence of spider silk,Science
The magic of the placebo,Science
The linguistic genius of babies,Science
The line between life and not-life,Science
The life code that will reshape the future,Science
The levitating superconductor,Science
The killer American diet that's sweeping the planet,Science
The intriguing sound of marine mammals,Science
The hunt for a supermassive black hole,Science
The hidden toxins in the fish we eat -- and how to stop them,Science
The hidden power of smiling,Science
The hidden influence of social networks,Science
The happy secret to better work,Science
The great penguin rescue,Science
The game that can give you 10 extra years of life,Science
The fight to end rare-animal trafficking in Brazil,Science
The fiction of memory,Science
The face of AIDS in Africa,Science
The emergent patterns of climate change,Science
The emergent genius of ant colonies,Science
The electric rise and fall of Nikola Tesla,Science
The economic injustice of plastic,Science
The Earth is full,Science
